검색어,기사 제목,기사요약
코알라,신문사가 '가상자산 지수' 만든 이유 [한경 코알라],한경DB 1월 12일 한국경제신문의 암호화폐 투자 뉴스레터 '코알라'에 실린 기사입니다. 주 5회 매일 아침 발행하는 코알라를 받아보세요!무료 구독신청 hankyung.com/newsletter 한국경제신문이 국내 언론사 최초로 지수 산출기관으로 인정받았습니다. 다음달 8...
코알라,코인값 예측하는 '차트 분석' 믿어야 할까 말아야 할까 [한경 코알라],1월 6일 한국경제신문의 암호화폐 투자 뉴스레터 '코알라'에 실린 기사입니다. 주 5회 매일 아침 발행하는 코알라를 받아보세요!무료 구독신청 hankyung.com/newsletter 기술적 분석이란? SNS에서 비트코인이나 암호화폐를 검색해보면 캔들 차트에 복잡한 선들을...
코알라,코알라 '연말 빅세일'..최고 40% 할인,호주 홈퍼니처 기업 코알라가 올해 마지막 대규모 세일 이벤트 '코알라 연말 빅세일'을 진행한다. [사진제공=코알라코리아] [아시아경제 김종화 기자] 호주 홈퍼니처 기업 코알라가 17일부터 26일까지 최대 40% 할인율로 2021년 대미를 장식할 '코알라 연말 빅세일...
코알라,NFT 관련 가상자산 지금 투자해도 될까? [한경 코알라],▶1월 3일 한국경제신문의 암호화폐 투자 뉴스레터 '코알라'에 실린 기사입니다.주 5회 매일 아침 발행하는 코알라를 받아보세요!무료 구독신청 hankyung.com/newsletter 지난 기고문에서 NFT(Non-Fungible Token·대체 불가능한 토큰)에 대한 관심이 뜨겁다고...
코알라,코알라 호주 소비자 만족도 평가 매트리스·베개 부문 1위 달성,호주 홈퍼니처 기업 코알라가 호주 소비자 만족도 평가 매트리스·베개 부문에서 1위를 차지했다. [사진제공=코알라 코리아] [아시아경제 김종화 기자] 호주 홈퍼니처 기업 코알라(Koala)가 호주 유력 소비자 만족도 조사 기관 '캔스타 블루(Canstar Blue)'가 진행한...
코알라,비트코인은 강하다 제롬 파월이 가격을 결정하지 않는다 [한경 코알라],1월 13일 한국경제신문의 암호화폐 투자 뉴스레터 '코알라'에 실린 기사입니다. 주 5회 매일 아침 발행하는 코알라를 받아보세요!무료 구독신청 hankyung.com/newsletter 칼을 빼든 연준 2022년 희망찬 새해가 밝았지만 암호화폐 시장 분위기는 암울하다. 지난 2년...
코알라,개발자 빨아들이는 이더리움·솔라나..가격 상승 이어지나 [한경 코알라],Forbes Electric Capital 1월 7일 한국경제신문의 암호화폐 투자 뉴스레터 '코알라'에 실린 기사입니다. 주 5회 매일 아침 발행하는 코알라를 받아보세요!무료 구독신청 hankyung.com/newsletter "다음 10년 동안 가치가 오를 암호화폐 플랫폼을 알고 싶다면...
코알라,잭 도시 비트코인 개발자 보호기금 만든다 [한경 코알라],한경DB 1월 13일 한국경제신문의 암호화폐 투자 뉴스레터 '코알라'에 실린 기사입니다. 주 5회 매일 아침 발행하는 코알라를 받아보세요!무료 구독신청 hankyung.com/newsletter 이 남자의 비트코인 사랑 역시 각별합니다. 트위터 창업자로 유명한 잭 도시 블록...
코알라,비트코인 조정 안 끝났다..'페이크 반등' 또 올 수도 [한경 코알라],서초구 반포동 고객지원센터에서 거래 상황을 지켜보고 있다. 신경훈 기자 1월 14일 한국경제신문의 암호화폐 투자 뉴스레터 '코알라'에 실린 기사입니다. 주 5회 매일 아침 발행하는 코알라를 받아보세요!무료 구독신청 hankyung.com/newsletter 비트코인이 지난...
코알라,북한 지난해 암호화폐 4억弗 해킹..절반은 이더리움 [한경 코알라],Chainalysis 1월 14일 한국경제신문의 암호화폐 투자 뉴스레터 '코알라'에 실린 기사입니다. 주 5회 매일 아침 발행하는 코알라를 받아보세요!무료 구독신청 hankyung.com/newsletter 북한이 지난해 3억9500만달러(약 4700억원) 규모의 암호화폐를 해킹한 것으로...
코알라,암호화폐 금지국은 몇 개일까 [한경 코알라],The Law Library of Congress 1월 6일 한국경제신문의 암호화폐 투자 뉴스레터 '코알라'에 실린 기사입니다. 주 5회 매일 아침 발행하는 코알라를 받아보세요!무료 구독신청 hankyung.com/newsletter '암호화폐 때려잡기'에 나선 나라들이 세계지도 위에 표시돼...
코알라,코알라 대신 이 색깔과 무늬..내가 몰랐던 '호주'의 재발견,레너드 워커의 ‘쿨유루’. 한국에서 ‘호주’ 하면 떠오르는 이미지는 단편적이다. 캥거루 코알라 오페라하우스 양모 정도일까. 서울시립미술관 서소문 본관에서 열리는 ‘경로를 재탐색합니다 UN/LEARNING AUSTRALIA’ 전은 이런 이미지를 깨고 ‘진짜 호주’를...
코알라,[위클리中企]코알라·밀워키·코멕스산업·스튜디오미콘,호주 홈퍼니처 기업 코알라가 대규모 프로모션 이벤트 ‘코알라 세일 페스타’를 진행한다. [사진제공=코알라 코리아] [아시아경제 김종화 기자] 호주 홈퍼니처 기업 코알라(Koala)가 오는 29일까지 다양한 스테디 셀러 제품들을 역대 최고 할인율로 선보이는 대규모...
코알라,김혜수 절친 이정은 등에 업힌 코알라..이렇게 귀엽기 있나요,(엑스포츠뉴스 이창규 기자) 배우 김혜수가 절친 이정은과의 비하인드샷을 공개했다. 14일 오후 김혜수는 자신의 인스타그램에 "#소년심판 #나근희 #심은석"이라는 글과 함께 사진을 게재했다. 공개된 사진 속 김혜수는 이정은의 등에 업힌 채 매달려 포즈를 취한...
코알라,비싸도 갖고 싶은..'럭셔리 브랜드'는 암호화폐에도 있다 [한경 코알라],▶12월 30일 한국경제신문의 암호화폐 투자 뉴스레터 '코알라'에 실린 기사입니다.주 5회 매일 아침 발행하는 코알라를 받아보세요!무료 구독신청 hankyung.com/newsletter 새벽 5시에 줄을 서야 살 수 있는 가방 얼마 전 친한 후배의 결혼식에 하객으로 참석했다...
코알라,트럼프는 사기랬는데..멜라니아 비트코인 지지자 됐나 [한경 코알라],트위터 @MELANIATRUMP 1월 5일 한국경제신문의 암호화폐 투자 뉴스레터 '코알라'에 실린 기사입니다. 주 5회 매일 아침 발행하는 코알라를 받아보세요!무료 구독신청 hankyung.com/newsletter 도널드 트럼프의 부인 멜라니아 트럼프가 3일(현지시간) 남긴 트윗...
코알라,'카자흐 사태' 유탄 맞은 비트코인 해시레이트 현재 상황은? [한경 코알라],Blockchain.com 1월 10일 한국경제신문의 암호화폐 투자 뉴스레터 '코알라'에 실린 기사입니다. 주 5회 매일 아침 발행하는 코알라를 받아보세요!무료 구독신청 hankyung.com/newsletter 최근 1년간 비트코인 해시레이트(hash rate) 그래프입니다. 블록체인닷컴에...
코알라,'방역 요새' 호주 2년만에 외국인 관광객 입국 허용(종합),코알라·캥거루 인형 들고 '입국 환영' (시드니 AFP=연합뉴스) 21일(현지시간) 호주 시드니 국제공항에서 코알라와 캥거루 인형을 든 이들이 입국자들을 환영하고 있다. 2022.2.21. photo@yna.co.kr (서울=연합뉴스) 백나리 기자 = 2년간의 강력한 입국 제한 조치로...
코알라,비트코인아 13번째 생일 축하해! [한경 코알라],ArtSwallow 1월 4일 한국경제신문의 암호화폐 투자 뉴스레터 '코알라'에 실린 기사입니다. 주 5회 매일 아침 발행하는 코알라를 받아보세요!무료 구독신청 hankyung.com/newsletter 비트코인이 13번째 생일을 맞은 것 알고 계셨나요? 미국 동부시간 기준 2009...
코알라,"짝짓기하다 성병 죽거나 불임"..호주 코알라 2050년 멸종위기,© News1 우동명 기자 (서울=뉴스1) 최서영 기자 = 호주의 대표적 동물 코알라가 산불과 성병 등으로 오는 2050년 멸종위기에 처할 것이란 분석이 나오고 있다. 지난 27일(현지시간) 외신에 따르면 최근 호주 일부 지역에 서식하는 코알라 사이에서 치명적인 성병...
코알라,NFT는 가상자산인가요? [한경 코알라],▶12월 7일 한국경제신문의 암호화폐 투자 뉴스레터 '코알라'에 실린 기사입니다.주 5회 매일 아침 발행하는 코알라를 받아보세요!무료 구독신청 hankyung.com/newsletter NFT(Non-Fungible Token·대체불가능토큰)가 그야말로 ‘핫(hot)’하다. 최근 만큼 NFT에...
코알라,호주 홈퍼니처 기업 '코알라' 고품질 수면 위한 '코알라 매트리스' 제안,호주를 대표하는 가구 브랜드 '코알라(Koala)'가 소비자 취향에 따라 양면으로 매트리스 경도를 선택할 수 있는 '코알라 매트리스'를 출시했다. 코알라는 호주의 자연에서 영감을 받은 소재와 색상을 바탕으로 편안함과 실용성을 강조한 홈퍼니처 기업으로 지난 7월...
코알라,[지구촌 Talk] 숟가락으로 음식 먹는 코알라 화제,숟가락은 더 이상 인간의 전유물이 아닙니다. 호주의 동물보호소에서 코알라가 숟가락을 이용해 음식을 먹는 모습이 포착돼 화제입니다. 최근 발바닥 부상을 입은 채 발견돼 보호소에 오게 된 수컷 코알라 '프랭클린'인데요. 사육사가 먹이통을 내밀자 입을 대고...
코알라,기후변화에 터전 잃고 '성병' 퍼져 불임까지..코알라의 비극,불임을 야기하는 전염병 클라미디아 걸린 코알라 [로이터 연합뉴스 자료사진. 재판매 및 DB 금지] (서울=연합뉴스) 이의진 기자 = 최근 기후 변화와 환경 파괴로 멸종 위기에 처한 호주의 코알라 사이에 치명적 성병이 확산해 종의 존속이 위협받고 있다고 미국 CNN...
코알라,[자막뉴스] '치명적 성병' 유행..'멸종 위기' 처한 코알라,호주 멜버른 거리 한복 판에 해골 형상의 거대한 코알라가 등장했습니다. 고통스러운 듯 신음을 토해냅니다. 해골 옷을 입은 시위대는 코알라가 죽어가고 있다며 기후문제 해결을 촉구했습니다. 호주의 코알라는 도시화로 보금자리를 잃고 기후위기로 산불이 자주...
코알라,호주 코알라 성병 감염률 85%..백신 효과 없으면 멸종,지난 2019년 호주 산불 당시 화재로 부상을 입은 코알라가 야전 병원에서 치료를 받고 있다. /사진=AFP/뉴스1 호주의 상징적인 동물 코알라 사이에서 '성병'이 퍼지면서 산불 등 서식지 파괴에 더해 개체 존속에 위협을 받고 있다. 7일(현지시간) 미국 CNN에 따르면...
코알라,비트코인 1억 간다더니..플랜비 예상 틀린 이유 [한경 코알라],사진=뉴스1 ▶12월 15일 한국경제신문의 암호화폐 투자 뉴스레터 '코알라'에 실린 기사입니다.주 5회 매일 아침 발행하는 코알라를 받아보세요!무료 구독신청 hankyung.com/newsletter 11월에 1억 간다더니? 비트코인 가격을 기술적 분석을 통해 예측하는 것으로...
코알라,"이더리움이 비트코인 넘어서는 일은 없을 것" [한경 코알라],경신한 지난달 9일 한 암호화폐거래소의 시세판 모습. 김영우 기자 ▶12월 20일 한국경제신문의 암호화폐 투자 뉴스레터 '코알라'에 실린 기사입니다.주 5회 매일 아침 발행하는 코알라를 받아보세요!무료 구독신청 hankyung.com/newsletter 암호화폐거래소 코빗이...
코알라,"NFT는 일반적으로 가상자산 아니다"는 금융위의 입장 무슨 의미일까? [한경 코알라],▶12월 23일 한국경제신문의 암호화폐 투자 뉴스레터 '코알라'에 실린 기사입니다.주 5회 매일 아침 발행하는 코알라를 받아보세요!무료 구독신청 hankyung.com/newsletter NFT(대체불가능토큰)에 관심을 갖고 계신 분들은 이미 알고 있겠지만 NFT가 특정금융정보...
코알라,코알라 다용도 '쿠쉬 소파베드 스툴' 출시,호주 홈퍼니처 기업 코알라가 출시한 편리함과 수납력 갖춘 다용도 '쿠쉬 소파베드 스툴'. [사진제공=코알라코리아] [아시아경제 김종화 기자] 코알라(Koala)가 디자인과 편안함 그리고 실용성을 모두 갖춘 '쿠쉬 소파베드 스툴' 4종을 출시했다. 코알라 쿠쉬 소파...
코알라,비트코인을 탐탁지 않아 하는 부모님을 설득하는 법 [한경 코알라],▶12월 22일 한국경제신문의 암호화폐 투자 뉴스레터 '코알라'에 실린 기사입니다.주 5회 매일 아침 발행하는 코알라를 받아보세요!무료 구독신청 hankyung.com/newsletter 결전의 날이 다가온다 이제 며칠 있으면 크리스마스다. 우리나라는 크리스마스를 따로 국가...
코알라,기후변화 '산불' 엎친데 '성병' 덮쳐..멸종 위협 받는 코알라,불임을 야기하는 전염병 클라미디아에 걸린 코알라 / 사진 = 연합뉴스 현지시간으로 오늘(7일) 미국 CNN방송에서는 호주의 코알라 사이에서 최근 기후 변화와 환경 파괴로 멸종 위기에 처하며 치명적 성병까지 확산해 종의 존속이 위협받고 있다고 보도했습니다...
코알라,2년 만에 공항 문 활짝 연 호주..세계 각국 속속 개방,순간입니다. 공항은 축제 분위기였습니다. 승객들은 저마다 꽃을 받아들었고 관광청에서는 호주의 특산품 베지마이트 잼과 코알라 인형을 들고 나와 이들을 환영했습니다. 오랜만에 상봉한 가족들은 오랫동안 서로를 껴안은 채 눈물을 흘렸고 [수 위튼/영국인...
코알라,유럽·호주·동남아 잇단 국경 개방..봄엔 갈 수 있을까,국경을 여는 나라가 늘고 있다. 호주는 이달 21일부터 백신 접종 외국인에게 무격리 입국을 허용했다. 시드니 공항에서 캥거루 코알라 인형을 건네며 방문객을 맞는 모습. [AFP=연합뉴스] 국경을 여는 나라가 늘고 있다. 한국과 달리 코로나 확산세가 꺾인 나라들...
코알라,워터파크인 줄..베이징 선수촌 누수 논란|AI가 Pick한 세상,춤을 추면서 해산 시도는 물거품이 됐습니다. 지금 시위대에게 필요한 건 노래가 아닌 대화가 아닐까요? ■ 호주 마스코트 코알라 멸종위기종 지정 보송한 회색털에 앙증맞은 발. 누구의 발일까요? 바로 호주를 상징하는 코알라입니다. 이 귀여운 코알라가 멸종...
코알라,[전의찬의 탄소중립 특강(4)] 기후가 뿔났다/탄소중립위원회 기후변화위원장,6개월간 지속되면서 서울 면적의 80배나 되는 산림을 불태웠다. 이 산불로 10만명 이상의 이재민이 발생했고 고유종인 코알라의 3분의1이 죽었다. 지난해 미국 북서부는 50도 가까운 기록적인 폭염으로 큰 피해를 봤다. 2011~2020년 연평균 산불 발생 면적은 3만㎢...
코알라,코알라 '굿잠' 캠페인 통해 코알라 매트리스만의 기술 소개,코알라가 샘공개한 '굿잠의 기술' 캠페인 영상. [사진제공=코알라코리아] [아시아경제 김종화 기자] 호주 홈퍼니처 기업 '코알라'가 호주 출신 방송인 샘 해밍턴과 함께한 '굿잠의 기술' 캠페인 영상을 공개했다. 굿잠의 기술 캠페인은 코알라가 지속해 온 수면 연구...
코알라,기후변화에 성병까지 확산.."코알라 멸종할 수도",[한국경제TV 김현경 기자] 최근 기후 변화와 환경 파괴로 멸종 위기에 처한 호주의 코알라 사이에서 치명적 성병이 확산하고 있다. 7일(현지시간) 미국 CNN방송에 따르면 최근 몇 년 사이 호주 일부 지역에서 코알라에 치명적 성병인 '클라미디아(Chlamydia) '가...
코알라,디지털 세상에서 '세계 최고층 빌딩의 저주'가 일어날까 [한경 코알라],▶12월 1일 한국경제신문의 암호화폐 투자 뉴스레터 '코알라'에 실린 기사입니다.주 5회 매일 아침 발행하는 코알라를 받아보세요!무료 구독신청 hankyung.com/newsletter 예상치 못한 물가상승 미제스에서 시작해 하이에크를 거쳐 계승 발전되어 온 오스트리아...
코알라,성병 퍼져 불임 산불·가뭄에 살 곳 없어진다..코알라의 눈물,지난해 호주 캥거루 아일랜드 파르다나에 있는 야생동물공원 비상대응센터에 부상당한 코알라가 앉아 있다. 로이터=연합뉴스 호주를 상징하는 동물 중 하나인 코알라가 최근 기후변화와 환경파괴로 서식지를 잃어가는 데 더해 치명적 성병이 확산해 종의 존속에...
